id,name,slug,description,announcement,hide,banner,body_three,order,facebook,twitter
19,A World of Food,a-world-of-food,"Students from around the world connect to study fruits, vegetables, and healthy eating! 6 Weeks • 30 mins per week • Ages 9 and up","Practice language skills and discover the world.
",t,course/19/12_02_2015_23_07_32_ng (1).jpg,"",100,"",""
17,Argument Writing,argument-writing,Students from across the United States connect to learn and practice argument writing skills. 7 Weeks • 45 mins / week • Ages 12 and up,"Practice language skills and discover the world.
",t,course/17/01_19_2016_21_35_24_.49 PM.png,"",100,"",""
1,World News ,world-news,Connects English speakers and learners to study global issues and current events in their PenPal's country.  6 Weeks • 45 mins per week • Ages 12 and up,Practice language skills and discover the world.,t,course/1/10_12_2015_14_54_13_solar.jpg,"",100,"",""
